{
  "after_snapshot": {
    "component_fingerprints": {
      "coverage": "354750b6299a9ab93480929aaaebe10e3bf2a1017d94178ab7c4e16e1b0da1df",
      "data_inventory": "b38f4717fb6f86f493be5564af9192b949ae978419ac4494f9982b4a0b0d06b7",
      "episodes": "2a67118fbf807a7d7961b0a633ddf685780c81c41ffbdd47b0ab26eee9a4d13a",
      "features": "85d2c18f29d51118e455a44146ad49606ef4b314ef32e6c740b962194fd44f5e",
      "format": "6b1259e933f3184e55d65d5b6f19e0856efd791af55a38dcc9c388bb612c57d1",
      "media_inventory": "4f53cda18c2baa0c0354bb5f9a3ecbe5ed12ab4d8e11ba873c2f11161202b945",
      "metadata_inventory": "1556e2545bad13ba7c4a42d455fc352afef36693c43599e96a63ff3278624403",
      "source": "9ab1a0ffc47bb4d8c7c1486f02216f1dfd7ae46a3a66416bbf0a57c279444752",
      "tasks": "746c6985faa332710986bb334dd171ec4772ce304a6e990d582e114d2e3f7664",
      "totals": "af414fa49ebdd19774b93a1dc88aa564867ea294048ad0b50eb95620c0946b33",
      "video_streams": "4f53cda18c2baa0c0354bb5f9a3ecbe5ed12ab4d8e11ba873c2f11161202b945"
    },
    "contract": {
      "episodes": [
        {
          "content_rows": 2,
          "content_sha256": "9546e8e4492b85412ac53e57366200944411341f7f32dc6581c343ba6bf796bd",
          "data_relation": {
            "dataset_from_index": 0,
            "dataset_to_index": 2,
            "path": "data/chunk-000/file-000.parquet"
          },
          "episode_index": 0,
          "extensions": {},
          "length": 2,
          "source": {
            "path": "meta/episodes/chunk-000/file-000.parquet",
            "row": 1
          },
          "source_ordinal": 0,
          "tasks": [
            "pick cube"
          ],
          "video_files": [],
          "video_segments": []
        }
      ],
      "features": [
        {
          "dtype": "float32",
          "key": "action",
          "metadata": {
            "info": {
              "coordinate_system": "joint",
              "normalization": "mean_std"
            }
          },
          "names": [
            "joint_a",
            "joint_b"
          ],
          "shape": [
            2
          ]
        },
        {
          "dtype": "int64",
          "key": "episode_index",
          "metadata": {},
          "names": null,
          "shape": [
            1
          ]
        },
        {
          "dtype": "int64",
          "key": "frame_index",
          "metadata": {},
          "names": null,
          "shape": [
            1
          ]
        },
        {
          "dtype": "int64",
          "key": "index",
          "metadata": {},
          "names": null,
          "shape": [
            1
          ]
        },
        {
          "dtype": "float32",
          "key": "observation.state",
          "metadata": {
            "info": {
              "coordinate_system": "joint",
              "normalization": "mean_std"
            }
          },
          "names": [
            "joint_a",
            "joint_b"
          ],
          "shape": [
            2
          ]
        },
        {
          "dtype": "int64",
          "key": "task_index",
          "metadata": {},
          "names": null,
          "shape": [
            1
          ]
        },
        {
          "dtype": "float32",
          "key": "timestamp",
          "metadata": {},
          "names": null,
          "shape": [
            1
          ]
        }
      ],
      "tasks": [
        {
          "extensions": {},
          "source": {
            "path": "meta/tasks.parquet",
            "row": 1
          },
          "task": "pick cube",
          "task_index": 0
        }
      ],
      "video_streams": []
    },
    "coverage": {
      "capabilities": [
        {
          "capability": "advisory.measurements",
          "checked": 1,
          "integrity": "full",
          "omitted": [],
          "selected": [
            "data/chunk-000/file-000.parquet"
          ],
          "status": "complete",
          "total": 1
        },
        {
          "capability": "alignment.data_relations",
          "checked": 1,
          "integrity": "full",
          "omitted": [],
          "selected": [],
          "status": "complete",
          "total": 1
        },
        {
          "capability": "alignment.episode_ranges",
          "checked": 1,
          "integrity": "full",
          "omitted": [],
          "selected": [],
          "status": "complete",
          "total": 1
        },
        {
          "capability": "alignment.task_foreign_keys",
          "checked": 1,
          "integrity": "full",
          "omitted": [],
          "selected": [
            "data/chunk-000/file-000.parquet"
          ],
          "status": "complete",
          "total": 1
        },
        {
          "capability": "alignment.timestamps",
          "checked": 1,
          "integrity": "full",
          "omitted": [],
          "selected": [
            "data/chunk-000/file-000.parquet"
          ],
          "status": "complete",
          "total": 1
        },
        {
          "capability": "alignment.video_relations",
          "checked": 0,
          "integrity": "full",
          "omitted": [],
          "selected": [],
          "status": "complete",
          "total": 0
        },
        {
          "capability": "content.checksum",
          "checked": 0,
          "integrity": "full",
          "omitted": [],
          "selected": [],
          "status": "complete",
          "total": 0
        },
        {
          "capability": "data.indexes",
          "checked": 1,
          "integrity": "full",
          "omitted": [],
          "selected": [
            "data/chunk-000/file-000.parquet"
          ],
          "status": "complete",
          "total": 1
        },
        {
          "capability": "data.inventory",
          "checked": 1,
          "integrity": "full",
          "omitted": [],
          "selected": [],
          "status": "complete",
          "total": 1
        },
        {
          "capability": "data.parquet_footer",
          "checked": 1,
          "integrity": "full",
          "omitted": [],
          "selected": [
            "data/chunk-000/file-000.parquet"
          ],
          "status": "complete",
          "total": 1
        },
        {
          "capability": "data.parquet_rows",
          "checked": 1,
          "integrity": "full",
          "omitted": [],
          "selected": [
            "data/chunk-000/file-000.parquet"
          ],
          "status": "complete",
          "total": 1
        },
        {
          "capability": "data.parquet_schema",
          "checked": 1,
          "integrity": "full",
          "omitted": [],
          "selected": [
            "data/chunk-000/file-000.parquet"
          ],
          "status": "complete",
          "total": 1
        },
        {
          "capability": "format.contract",
          "checked": 1,
          "integrity": "full",
          "omitted": [],
          "selected": [],
          "status": "complete",
          "total": 1
        },
        {
          "capability": "media.declared_contract",
          "checked": 0,
          "integrity": "full",
          "omitted": [],
          "selected": [],
          "status": "complete",
          "total": 0
        },
        {
          "capability": "media.decode",
          "checked": 0,
          "integrity": "full",
          "omitted": [],
          "selected": [],
          "status": "complete",
          "total": 0
        },
        {
          "capability": "media.inventory",
          "checked": 0,
          "integrity": "full",
          "omitted": [],
          "selected": [],
          "status": "complete",
          "total": 0
        },
        {
          "capability": "media.metadata",
          "checked": 0,
          "integrity": "full",
          "omitted": [],
          "selected": [],
          "status": "complete",
          "total": 0
        },
        {
          "capability": "metadata.episode_indexes",
          "checked": 1,
          "integrity": "full",
          "omitted": [],
          "selected": [
            "meta/episodes/chunk-000/file-000.parquet"
          ],
          "status": "complete",
          "total": 1
        },
        {
          "capability": "metadata.episodes",
          "checked": 1,
          "integrity": "full",
          "omitted": [],
          "selected": [],
          "status": "complete",
          "total": 1
        },
        {
          "capability": "metadata.info",
          "checked": 1,
          "integrity": "full",
          "omitted": [],
          "selected": [],
          "status": "complete",
          "total": 1
        },
        {
          "capability": "metadata.stats",
          "checked": 0,
          "integrity": "full",
          "omitted": [],
          "reason": "Optional file missing.",
          "reason_code": "optional_file_missing",
          "selected": [],
          "status": "unavailable",
          "total": 1
        },
        {
          "capability": "metadata.tasks",
          "checked": 1,
          "integrity": "full",
          "omitted": [],
          "selected": [],
          "status": "complete",
          "total": 1
        },
        {
          "capability": "metadata.totals",
          "checked": 1,
          "integrity": "full",
          "omitted": [],
          "selected": [
            "meta/info.json"
          ],
          "status": "complete",
          "total": 1
        },
        {
          "capability": "source.identity",
          "checked": 1,
          "integrity": "full",
          "omitted": [],
          "selected": [],
          "status": "complete",
          "total": 1
        },
        {
          "capability": "stats.recomputed",
          "checked": 2,
          "integrity": "full",
          "omitted": [],
          "reason": "Statistics were recomputed but no stored values exist to compare.",
          "reason_code": "stored_stats_unavailable",